[
  {
    "id": "abu-bakr",
    "name": {
      "en": "Abu Bakr As-Siddiq",
      "ar": "أَبُو بَكْر",
      "ur": "ابو بکر صدیق رضی اللہ عنہ"
    },
    "aliases": [
      "As-Siddiq (The Truthful)",
      "Second of Two (in the cave)",
      "Atiq (freed by Allah from Fire)"
    ],
    "kind": "companion",
    "order": 1,
    "path": "straight",
    "pathOrder": 41,
    "pathLabel": {
      "en": "Straight Path",
      "ur": "صراط مستقیم"
    },
    "pathReason": "Referenced in the Quran as 'the second of two in the cave' (9:40); the Prophet ﷺ comforted him with 'Do not grieve; Allah is with us'",
    "era": "570-634 CE, Makkah and Madinah",
    "story": {
      "en": "The closest companion of the Prophet ﷺ and his father-in-law. The Quran references him in 9:40 during the Hijra: hiding in the cave of Thawr with the Prophet, he was afraid — 'Do not grieve; indeed Allah is with us.' He is believed by scholars to be referenced in 92:17-21 as 'the one who gives his wealth for purification, not expecting any favor in return, only seeking the pleasure of his Lord the Most High.' The first adult male to embrace Islam. The Prophet's closest companion. First Caliph after the Prophet's death.",
      "ur": "غار ثور میں ہجرت کے دوران نبی ﷺ کے ساتھ — 'غم نہ کرو، اللہ ہمارے ساتھ ہے' (9:40)۔ سب سے پہلے ایمان لانے والے بالغ مرد۔ خلیفہ اول۔"
    },
    "lessons": [
      "Companionship in the cause of Allah is itself a blessing referenced in the Quran",
      "Grief in a righteous cause is met with divine reassurance",
      "Giving wealth purely for Allah's pleasure — 92:17-21 is his portrait"
    ],
    "ayaat": [
      "9:40",
      "92:17",
      "92:18",
      "92:19",
      "92:20",
      "92:21"
    ],
    "connected": [
      "muhammad",
      "aisha"
    ],
    "themes": [
      "sahabah",
      "hijrah",
      "sidq",
      "tawakkul",
      "wealth",
      "zakat",
      "story-muhammad"
    ]
  },
  {
    "id": "abu-jahl",
    "name": {
      "en": "Abu Jahl",
      "ar": "أَبُو جَهْل",
      "ur": "ابو جہل"
    },
    "aliases": [
      "Amr ibn Hisham",
      "Father of Ignorance (nickname given by Muslims)"
    ],
    "kind": "person",
    "order": 20,
    "path": "deviated",
    "pathOrder": 13,
    "pathLabel": {
      "en": "Deviated Path",
      "ur": "گمراہی"
    },
    "pathReason": "One of the most violent persecutors of early Muslims; killed at Badr; referenced in 96:9-18",
    "era": "Makkah, died 624 CE at Battle of Badr",
    "story": {
      "en": "One of the chieftains of Quraysh and the most vicious persecutor of the Prophet ﷺ and early Muslims. His real name was Amr ibn Hisham; Muslims called him Abu Jahl (Father of Ignorance). Surah Al-Alaq (96:9-18) was revealed about him specifically — describing 'the one who forbids a servant from praying,' threatening to grab him by the forelock if he saw the Prophet praying. He persecuted, tortured, killed early Muslims (including Sumayyah — the first martyr). He died at the Battle of Badr — young companions recognized and killed him. His treatment was exactly as the Quran had warned: dragged by the forelock.",
      "ur": "قریش کا سردار، سب سے ظالم ستانے والا۔ اصل نام عمرو بن ہشام۔ سورۃ العلق (96:9-18) اسی کے بارے میں نازل ہوئی — نماز پڑھنے سے روکنے والا۔ سمیہ رضی اللہ عنہا کا قاتل۔ بدر میں مارا گیا — پیشانی سے گھسیٹا گیا جیسا قرآن نے کہا تھا۔"
    },
    "lessons": [
      "Preventing people from worship is specifically condemned",
      "The Quran's prophecy about his forelock was literally fulfilled at Badr",
      "Despite great social power and intellect, he chose destruction"
    ],
    "ayaat": [
      "96:9",
      "96:10",
      "96:11",
      "96:12",
      "96:13",
      "96:14",
      "96:15",
      "96:16",
      "96:17",
      "96:18"
    ],
    "connected": [
      "muhammad",
      "sumayyah"
    ],
    "themes": [
      "story-muhammad",
      "oppression",
      "kufr",
      "kibr",
      "battle-badr"
    ]
  },
  {
    "id": "abu-lahab",
    "name": {
      "en": "Abu Lahab",
      "ar": "أَبُو لَهَب",
      "ur": "ابو لہب"
    },
    "aliases": [
      "Abd al-Uzza ibn Abd al-Muttalib",
      "Father of Flame"
    ],
    "kind": "person",
    "order": 18,
    "path": "deviated",
    "pathOrder": 11,
    "pathLabel": {
      "en": "Deviated Path",
      "ur": "گمراہی"
    },
    "pathReason": "The only person condemned by name in the Quran (111:1-5); active enemy of the Prophet ﷺ despite being his uncle",
    "era": "Before Islam, Makkah, died 624 CE",
    "story": {
      "en": "Uncle of the Prophet ﷺ (son of Abd al-Muttalib, making him a blood relative). Yet he was the most virulent enemy of the Prophet in Makkah. When the Prophet ﷺ called his clan to Islam, Abu Lahab responded: 'May you perish! Is this why you called us?' An entire surah (Al-Masad) is revealed condemning him and his wife by name — the only such specific condemnation in the Quran. He would follow the Prophet in the markets undoing his message. He and his wife are condemned to the Fire. His wife Umm Jamil would carry thorny branches to scatter in the Prophet's path.",
      "ur": "نبی ﷺ کے چچا لیکن سب سے بڑے دشمن۔ 'تیرے ہاتھ ٹوٹیں، تو ہلاک ہو' کہا۔ قرآن نے نام لے کر مذمت کی — واحد شخص (111:1-5)۔ بیوی کانٹے ڈالتی تھی راستے میں۔"
    },
    "lessons": [
      "Blood relation to a prophet does not guarantee faith or protection",
      "Active opposition to truth brings specific divine condemnation",
      "The Quran's prophecy — Abu Lahab would not believe — was fulfilled, proving the Quran's divine origin",
      "Wealth and children are no protection from divine judgment (111:2)"
    ],
    "ayaat": [
      "111:1",
      "111:2",
      "111:3",
      "111:4",
      "111:5"
    ],
    "connected": [
      "muhammad",
      "umm-jamil"
    ],
    "themes": [
      "story-muhammad",
      "kufr",
      "family",
      "wealth",
      "jahannam"
    ]
  },
  {
    "id": "adam",
    "name": {
      "en": "Adam",
      "ar": "آدَم",
      "ur": "آدم علیہ السلام"
    },
    "aliases": [
      "The First Human",
      "Abu al-Bashar",
      "Khalifah"
    ],
    "kind": "prophet-messenger",
    "order": 1,
    "path": "straight",
    "pathOrder": 1,
    "pathLabel": {
      "en": "Straight Path",
      "ur": "صراط مستقیم"
    },
    "pathReason": "Erred but repented sincerely; chosen, guided, and forgiven by Allah (20:122)",
    "era": "Beginning of humanity",
    "story": {
      "en": "Created from clay as Allah's vicegerent on earth. Taught the names of all things. Commanded to prostrate — Iblis refused. Placed in Jannah with Hawwa, forbidden one tree. Deceived by Iblis, ate from the tree, fell to earth. Repented with the words taught by Allah, was forgiven and chosen as a prophet. His story establishes: the nature of free will, the danger of Iblis, the power of repentance, and the purpose of human existence.",
      "ur": "مٹی سے بنائے گئے، اللہ کے خلیفہ۔ تمام چیزوں کے نام سکھائے گئے۔ ابلیس نے سجدہ نہ کیا۔ جنت میں رکھے گئے، ممنوعہ درخت کھایا، زمین پر اتارے گئے۔ اللہ کی سکھائی دعا سے توبہ کی، معاف ہوئے اور نبی چنے گئے۔"
    },
    "lessons": [
      "Repentance wipes out any sin if sincere",
      "Iblis's arrogance (refusing to bow to Adam) is the root of all evil",
      "Knowledge (of names/reality) is humanity's distinguishing gift",
      "The earth is a test, not a punishment",
      "Human dignity was established before the first sin"
    ],
    "ayaat": [
      "2:30",
      "2:31",
      "2:33",
      "2:35",
      "2:36",
      "2:37",
      "3:33",
      "3:59",
      "5:27",
      "7:11",
      "7:19",
      "7:23",
      "7:26",
      "17:61",
      "18:50",
      "19:58",
      "20:115",
      "20:116",
      "20:120",
      "20:121",
      "20:122"
    ],
    "connected": [
      "hawwa",
      "iblis",
      "habil",
      "qabil"
    ],
    "themes": [
      "story-adam",
      "prophethood",
      "human-creation",
      "purpose-of-life",
      "shaytan",
      "tawbah",
      "qadr"
    ]
  },
  {
    "id": "aisha",
    "name": {
      "en": "Aisha bint Abi Bakr",
      "ar": "عَائِشَة",
      "ur": "عائشہ رضی اللہ عنہا"
    },
    "aliases": [
      "Umm al-Mu'minin (Mother of the Believers)",
      "Al-Humayra",
      "Scholar of Islam"
    ],
    "kind": "companion",
    "order": 3,
    "path": "straight",
    "pathOrder": 43,
    "pathLabel": {
      "en": "Straight Path",
      "ur": "صراط مستقیم"
    },
    "pathReason": "Mother of the Believers; Allah directly revealed her innocence in the Quran (24:11-20) — the greatest divine vindication",
    "era": "613-678 CE, Makkah and Madinah",
    "story": {
      "en": "Youngest wife of the Prophet ﷺ and daughter of Abu Bakr. The incident of Al-Ifk (the slander): hypocrites spread false accusations about her. Allah revealed ten ayaat (24:11-20) establishing her complete innocence and condemning those who spread the slander. One of the greatest scholars of Islam — narrated thousands of hadith. The Prophet ﷺ said 'Learn half your religion from Humaira.' She is an Umm al-Mu'minin — a mother of all believers.",
      "ur": "نبی ﷺ کی زوجہ، ابو بکر کی بیٹی۔ افک کا واقعہ: منافقین نے الزام لگایا، اللہ نے دس آیات سے براءت ظاہر کی (24:11-20)۔ ہزاروں حدیث کی راوی، اسلام کی عظیم عالمہ۔"
    },
    "lessons": [
      "Divine vindication — Allah Himself cleared her name",
      "Slander (qadhf) is a major sin — the Quran warned severely against it",
      "Women as primary transmitters of knowledge — Aisha taught the entire ummah",
      "Patience in facing false accusation — trusting Allah's eventual clarity"
    ],
    "ayaat": [
      "24:11",
      "24:12",
      "24:16",
      "24:17",
      "24:23",
      "33:6",
      "33:32",
      "33:53",
      "66:3",
      "66:4"
    ],
    "connected": [
      "muhammad",
      "abu-bakr"
    ],
    "themes": [
      "prophets-household",
      "sahabah",
      "incident-ifk",
      "women",
      "knowledge",
      "speech-ethics"
    ]
  },
  {
    "id": "ali",